event,selector,selector_url,division,prize,work,title,author_url,author,review,work_license,review_license
毎月短歌24,伏見幸慈,https://x.com/kenzkenz67,自選,気になった歌,指先で線香花火と打つときも大きい花火のエフェクトが出る,,https://x.com/sonatine_yuki,村川愉季,LINEが季節に合わせ、桜を出したり雪を降らせたり、母の日の花束を出してくれる。線香花火の「花火」だけに反応して、大きな花火を打ち上げてくることを切り取ったのは、良い発見だ。,CC BY-NC-ND 4.0,CC BY-NC-ND 4.0
毎月短歌24,伏見幸慈,https://x.com/kenzkenz68,自選,気になった歌,次きみが海のいのちになるときはわたしの骨をゆっくり食べて,,https://x.com/carda_mm,漁火いさな,骨を食べてもらうことでしか満たすことのできない、主体の屈折した、けれど切実な願いが表れている。生き物を限定せず、「海のいのち」としたところに歌の広がりがある。,CC BY-NC-ND 4.0,CC BY-NC-ND 4.0
毎月短歌24,ぶりきのかに,https://x.com/buriki_tanka,自選,１席,きみの揺らす現像液は羊水のようだわたしを何度も産んで,,はるかぜ,https://twitter.com/spring_bird_gr,"現像処理が必要なフィルムカメラで撮る、私にはこの行為自体に特別性が感じられますが、この歌で切り取られているのは、現像の工程にも、まさにその二人が居合わせている様子です。羊水という比喩なども踏まえて、「きみ」を男性、「わたし」を女性と読みました。フィルムの現像は、フィルムを現像液に浸して液を攪拌することで色調が反転され像が浮かび上がるというプロセスであり、フィルムに映る連続した「わたし」が、今「きみ」の手元で産まれたのだ、という感覚を覚えさせたのでしょう。自分の誕生を見つめる「わたし」の横には、フィルムの「わたし」を励起させた「きみ」がいる。「きみ」が写真を撮って後天的に「わたし」を何度も産んだのを「わたし」は目の当たりにした。ネガからポジへ反転させる現像は「きみ」によって行われた。「きみ」が「わたし」を産んだという奇跡と、それが空想の域でしかないことを「わたし」は""""萌芽として""""知っている。でも「きみ」の手で「わたし」が産まれたことは確かで、「きみ」の中にも今まで出会ったことのない「わたし」が少しだけ息づいたのかもしれない。2人の間に交錯する複雑な思いがこの歌の瞬間に凝縮されていると感じ、今回特に惹かれた歌ということで1席に選ばせていただきました。",CC BY-NC-ND 4.0,CC BY-NC-ND 4.0
毎月短歌24,ぶりきのかに,https://x.com/buriki_tanka,自選,２席,指先で線香花火と打つときも大きい花火のエフェクトが出る,,村川愉季,https://twitter.com/sonatine_yuki,試しにスマホ打ってみたら、バカでかい花火の絵文字が出ました。予測変換は細かい事情を考慮してくれなくて、「お出かけ」と打ったら爆走する赤い自動車が出ます。ちょうどこんな感じで🚗💨いつもすぐ早とちりして世話を焼いてくるけど頭の良いやつが「花火ってこれでしょ」みたいに自信満々に掲げてくるのがかわいくて、そんなに言うなら採用してあげたくなる。多分そんな現象が日本中で起きていて、そしてそもそも線香花火なんてかわいい花火は海外に無いから一向に絵文字もできなくて、だから「線香花火🎆」が今日もどこかで打ちあがっているんだろう。そんな想像がはたらく面白い歌で、単なるあるあるに留まらないところがすごく良いなと思いました。（余談）誰だったか忘れたけど、お母さんからのメールに「買い物行ってきます✈️」と書いてあったエピソードを思い出しました。,CC BY-NC-ND 4.0,CC BY-NC-ND 4.0
毎月短歌24,ぶりきのかに,https://x.com/buriki_tanka,自選,３席,カステラの粗目糖《ざらめ》払って指先に光の雨を降らせるあなた,,川瀬十萠子,https://twitter.com/nagikawase,カステラのいちばんおいしいとこが指に付いて、あなたは払ってキラキラした雨を降らせた。（舐めちゃったらいいのに）と思っただろうか。しかし粗目糖は口に取り込まないことで光の雨になることができた。あなたは知ってそれをやったわけではないと思う。単に育ちが良かっただけかもしれない。粗目糖を光の雨にしたのは作中主体自身であり、あなただけでは雨は降らなかったのだ。主体の中では雨が降り、あなたにそれを伝えても伝えなくてもいい。雨の流れゆく先のことを考えてもいいし、考えなくてもいい。この歌の景自体とても魅かれるものでありますが、背後には短歌そのものに通底する魅力が秘められていると感じました。,CC BY-NC-ND 4.0,CC BY-NC-ND 4.0
毎月短歌24,ぶりきのかに,https://x.com/buriki_tanka,自選,佳作,繰り返すサイトカインストームと闘ってボクらの舌はいつだって苺色,,古井　朔,https://twitter.com/saku_furui,サイトカインストームとは免疫反応が暴走して正常な細胞まで攻撃されることのようです。痛みの中に生きるボクに対し、舌の苺色という生命感をもってきて、その上で「ボクら」と括っているのが、戦いから降りないという覚悟をぴったりと捉えていると思いました。,CC BY-NC-ND 4.0,CC BY-NC-ND 4.0
毎月短歌24,ぶりきのかに,https://x.com/buriki_tanka,自選,佳作,少年がベビーカーから顔を出す　春よ、少女だったかもしれない,,右手のハンマー,https://twitter.com/migitenohammer,その赤子をはじめ少年のようだと思った。それから少女のような気がしてきた。祝福のような赤子、どちらにせよ、春のあいまいな勢いに力を与えていく。春に見る景色や語る言葉は、あいまいで良い気がしてくる。そのような許しがこの歌から感じられました。,CC BY-NC-ND 4.0,CC BY-NC-ND 4.0
毎月短歌24,ぶりきのかに,https://x.com/buriki_tanka,自選,佳作,青虫の溶けて記憶も翅になる思い出さない茂みのほくろ,,よしなに,https://twitter.com/yoshinani_tanka,茂みは髪だったり陰毛だったり、毛のことだと解釈しました。その人には、確かに茂みの中のほくろがあった。今や翅のように決意的に、ほくろの記憶から離れようとしているのでしょうか。「青虫の溶けて」からほくろへと転じていく過程が見事だと思いました。,CC BY-NC-ND 4.0,CC BY-NC-ND 4.0
毎月短歌24,ぶりきのかに,https://x.com/buriki_tanka,自選,好きな短歌,命日はあなたがあちらで生まれた日、って思うことにして花束,,Umi.,https://twitter.com/Umi1146295,,CC BY-NC-ND 4.0,CC BY-NC-ND 4.0
毎月短歌24,ぶりきのかに,https://x.com/buriki_tanka,自選,好きな短歌,『プリンノセターノ』『フルーツモッターノ』あなたをもっと笑わせたかった,,インアン,https://twitter.com/inan_erotica,,CC BY-NC-ND 4.0,CC BY-NC-ND 4.0
毎月短歌24,ぶりきのかに,https://x.com/buriki_tanka,自選,好きな短歌,街の灯のひとつひとつがぎらつきを隠さなくなる夏を含んで,,せんぱい,https://twitter.com/tenran_harugiri,,CC BY-NC-ND 4.0,CC BY-NC-ND 4.0
毎月短歌24,ぶりきのかに,https://x.com/buriki_tanka,自選,好きな短歌,お互いに口内炎をみせあって祝日のない月の伴走,,はるかぜ,https://twitter.com/spring_bird_gr,,CC BY-NC-ND 4.0,CC BY-NC-ND 4.0
毎月短歌24,ぶりきのかに,https://x.com/buriki_tanka,自選,好きな短歌,夕焼けとすこしの夜をかきまぜるように手を振る六時の公園,,メタのおわり,https://twitter.com/_i_il_i_,,CC BY-NC-ND 4.0,CC BY-NC-ND 4.0
毎月短歌24,ぶりきのかに,https://x.com/buriki_tanka,自選,好きな短歌,泣きながら貝殻に耳を押しあてて無神論者の歌う讃美歌,,ゆかりごはん,https://twitter.com/iam_yukarigohan,,CC BY-NC-ND 4.0,CC BY-NC-ND 4.0
毎月短歌24,ぶりきのかに,https://x.com/buriki_tanka,自選,好きな短歌,挨拶が「おつかれ」になった君はもうプリンをプッチンしないのだろう,,ゆかりごはん,https://twitter.com/iam_yukarigohan,,CC BY-NC-ND 4.0,CC BY-NC-ND 4.0
毎月短歌24,ぶりきのかに,https://x.com/buriki_tanka,自選,好きな短歌,暗闇に目がなれるまでそばにいて白紫陽花のうなじの焔,,よしなに,https://twitter.com/yoshinani_tanka,,CC BY-NC-ND 4.0,CC BY-NC-ND 4.0
毎月短歌24,ぶりきのかに,https://x.com/buriki_tanka,自選,好きな短歌,勝手だね君は猫だというだけで私の庭で花を嗅いでる,,宇井モナミ,https://twitter.com/kijousan,,CC BY-NC-ND 4.0,CC BY-NC-ND 4.0
毎月短歌24,ぶりきのかに,https://x.com/buriki_tanka,自選,好きな短歌,私書箱があったらいいな私書箱の手紙を取りにいくときの靴,,宇祖田都子,https://twitter.com/Shinnsyutu2020,,CC BY-NC-ND 4.0,CC BY-NC-ND 4.0
毎月短歌24,ぶりきのかに,https://x.com/buriki_tanka,自選,好きな短歌,もうママを辞めたいなんて言ったことマックシェイクで吸い込んでいる,,奥　かすみ,https://twitter.com/okukasumi,,CC BY-NC-ND 4.0,CC BY-NC-ND 4.0
毎月短歌24,ぶりきのかに,https://x.com/buriki_tanka,自選,好きな短歌,トーストにお手製レモンカード乗せきみの光で朝が始まる,,月瀬 葵葉,https://twitter.com/aoha_tsukise,,CC BY-NC-ND 4.0,CC BY-NC-ND 4.0
毎月短歌24,ぶりきのかに,https://x.com/buriki_tanka,自選,好きな短歌,いつまでも等間隔の傘でした明月院のブルーは濡れて,,古井　朔,https://twitter.com/saku_furui,,CC BY-NC-ND 4.0,CC BY-NC-ND 4.0
毎月短歌24,ぶりきのかに,https://x.com/buriki_tanka,自選,好きな短歌,包丁がなまくらなのでアボカドの種切れないしまだ指がある,,汐留ライス,https://twitter.com/RCodome,,CC BY-NC-ND 4.0,CC BY-NC-ND 4.0
毎月短歌24,ぶりきのかに,https://x.com/buriki_tanka,自選,好きな短歌,「わかる」ってミルクみたいなふりをして紅茶を濁らせてゆく痛み,,真朱,https://twitter.com/l0vemash,,CC BY-NC-ND 4.0,CC BY-NC-ND 4.0
毎月短歌24,ぶりきのかに,https://x.com/buriki_tanka,自選,好きな短歌,玉ねぎを千に切る音涼しくて初夏の鼓膜に雪を踏む音,,川瀬十萠子,https://twitter.com/nagikawase,,CC BY-NC-ND 4.0,CC BY-NC-ND 4.0
毎月短歌24,ぶりきのかに,https://x.com/buriki_tanka,自選,好きな短歌,海鮮丼待ってる君の表情が写ルンですの暗がりにある,,村川愉季,https://twitter.com/sonatine_yuki,,CC BY-NC-ND 4.0,CC BY-NC-ND 4.0
毎月短歌24,ぶりきのかに,https://x.com/buriki_tanka,自選,好きな短歌,喜捨という言葉の響き美しく教科書でしか知らぬイスラム,,奈路 侃,https://twitter.com/osorakukajin,,CC BY-NC-ND 4.0,CC BY-NC-ND 4.0
毎月短歌24,ぶりきのかに,https://x.com/buriki_tanka,自選,好きな短歌,この詩には二人以上の悲しみがあってあれが安達太良山だよ,,乃木ひかり,https://twitter.com/nuttarifan,,CC BY-NC-ND 4.0,CC BY-NC-ND 4.0
毎月短歌24,ぶりきのかに,https://x.com/buriki_tanka,自選,好きな短歌,作っても作ってもすぐ無くなった麦茶が減らずやたら冷たい,,木ノ宮むじな,https://twitter.com/rebelxduck,,CC BY-NC-ND 4.0,CC BY-NC-ND 4.0
毎月短歌24,村田真央,https://x.com/maomurataxyz,自選,金賞,鏡の国のローソンだ レジ打ちの田中は中田 心臓は右,,てん,https://x.com/TEN_57577,一読して、異世界に突然迷い込んでしまったような不安と恐怖を覚えました。通いなれたローソンに入店すると何かがおかしい。レイアウトが違う、商品名も逆さま、レジの田中さんは中田さんになっている…。もしかして全部、鏡写しになっている？と理解し始めたとき、高鳴る心臓の鼓動は自分の「右」胸から聞こえてくる…（ぎゃーーーー！！）２か所に挿入された一字空けの効果でカメラが次々と切り替わり、ホラー映画のように緊迫感と焦燥感を煽られているようでした。また、「鏡の国のローソンだ」の部分。「かがみのくにの／ろーそんだ」と７・５音になっており、「…ここも鏡！？」と気付いた時はめっちゃくちゃ怖かったです。このローソンから退店すれば、心臓の位置は元に戻るのでしょうか。それとも世界がすべて鏡の国になっているのでしょうか。ずっと気になって頭から離れないので、金賞とさせていただきました。,CC BY-NC-ND 4.0,CC BY-NC-ND 4.0
毎月短歌24,村田真央,https://x.com/maomurataxyz,自選,銀賞,アンデルセン童話の少し無理のある和訳でいいじゃないか はたらく,,村崎残滓,https://x.com/murasaki_zanshi,"すべての働く人の心に刺さる短歌なのでは、と胸が熱くなりました。
翻訳には詳しくありませんが、そもそも文化も風習も時代も違う国の物語を和訳するのですから、正確性などについてどこかで妥協が必要な作業になるかと思います。どんな仕事においても、常に全員にとって正しい答えを出し続けるということは不可能に近いですね。私自身も働く上で「あの時どうすればよかったのか？」と思い悩む場面が少なからずあります。
自分自身を「いいじゃないか」と優しく励まし、傷つき悩みながらも前を向いて、それでも「はたらく」という選択をする力強さに、とても勇気をいただいた短歌でした。",CC BY-NC-ND 4.0,CC BY-NC-ND 4.0
毎月短歌24,村田真央,https://x.com/maomurataxyz,自選,銀賞,もし巨女に言いたいことがあるときは鉄塔に貼るといいよ付箋を,,てん,https://x.com/TEN_57577,"一読した後に、疑問符がたくさん湧いてきました。まず巨女ってなに？と思ったら、どうやら気付いてもらうのに鉄塔が必要なくらい背が高いらしい。だとすればおそらく鉄塔の「できるだけ高い位置に」「目に留まるくらい大きい」付箋を貼らないといけないはずなのに、それを簡単そうにアドバイスしているこの人は誰なの。そして誰にアドバイスしているの。そもそも巨女さんに何の用があるの。
たくさんのストーリーが湧いてくる奥行きのある短歌で、いろいろな疑問も自分で考察するのがすごく楽しかったです。
ちなみに私の中の巨女さんは、制服・パンプス姿のOLさんでした。",CC BY-NC-ND 4.0,CC BY-NC-ND 4.0
毎月短歌24,村田真央,https://x.com/maomurataxyz,自選,銅賞,うなずいてしまうNISAの説明のように指輪を差し出す人に,,インアン,https://x.com/inan_erotica,"指輪はきっとプロポーズ用かなと読んだのですが、ちょっと待って。
「○○した方が得」とか「何歳までに○○すべき」とかプレゼンされて、その延長でプロポーズされたら確かに「そうだよな～」ってOKしてしまいそう。でも、うなずいて「しまう」って、勢いに押されて流されているような…。もし私が友達だったら「本当にいいの？大丈夫なの？」とか言ってしまいそう。
ちょっと不安を感じつつも、でも幸せになるかどうかは結局これからの二人次第ですよね。様々な感情が湧き起こった一首で、すごく好きでした。",CC BY-NC-ND 4.0,CC BY-NC-ND 4.0
毎月短歌24,村田真央,https://x.com/maomurataxyz,自選,銅賞,母さんの幽霊がまだここにいて「砂糖が先」と目を光らせる,,田仲トオル,https://x.com/tanankatoru,"亡くなったお母さんから教わったレシピと手順に忠実に料理をしている場面だと思います。お母さんの幽霊がずっと台所にいて、しかも一挙手一投足に目を光らせていることに謎の説得力と緊張感がありました。
お母さんって幾つになっても（もしかすると亡くなった後も）自分の子どものことが心配だろうし、ついつい口を出したくなっちゃうんだろうな。厳しくも愛情深いお母さんだったんだろうな、としみじみ切なく感じた歌でした。",CC BY-NC-ND 4.0,CC BY-NC-ND 4.0
毎月短歌24,村田真央,https://x.com/maomurataxyz,自選,銅賞,カニカマの片側裂いてひらひらのしっぽを作る（泳いでいいよ）,,サ行,https://x.com/Ns4HhpKEzA10870,一読してかわいらしい短歌だな、と思ったのですが、これもちょっと待って。カニカマって原材料は魚なのに蟹に似せて成形した食べ物で、それなのにまたしっぽを作って「泳いでいいよ」？もしかしてちょっと怖い歌？と私は読みました。例えば子どもの頃など、無邪気ゆえに残酷なことをしてしまった経験が誰しもあるかと思います。やわらかで優しい文体で包んだ中に、はっとさせられる気付きがある奥の深い短歌で、とても好きでした。,CC BY-NC-ND 4.0,CC BY-NC-ND 4.0
毎月短歌24,村田真央,https://x.com/maomurataxyz,自選,銅賞,起きぬけに塩むすびほおばる これは今日あとで泣くぶんの塩分,,萎竹,https://x.com/sinachiku_no_yo,"どうしても泣くのを避けられない出来事がこの後待っているんですね。（勝ち目のない告白などをする予定なのかも、と読みました）
訪れる悲しみを予期しているのに、そのことを避けもせず受け止める覚悟で、流れ出てしまうだろう塩分の補給のためにおむすびを食べる人は、本当に偉いし強い。すごい！頑張っておいで！と心の底から応援したくなる短歌でした。帰ってきたらおいしい夕ご飯をたくさん食べさせてあげたい。
また、「なくぶんのえんぶん」の部分が、口に出して読んでみると気持ちよくて、それも何だかかわいくて切なかったです。",CC BY-NC-ND 4.0,CC BY-NC-ND 4.0
毎月短歌24,村田真央,https://x.com/maomurataxyz,自選,銅賞,ユニクロの商品棚でメンズ用ジーンズ蒼くグラデーションす,,宇井モナミ,https://x.com/kijousan,ユニクロに行った際に、商品が整然と畳まれたカラフルな棚を見るのが好きです。メンズ用商品の棚はじっくり見たことがあまりありませんでしたが、初夏はきっと青いジーンズが他の季節よりも多くて、段々と色味が濃くなっていくグラデーションが美しいのでしょうね。店内の光景がぱっと鮮やかに目に浮かび、もうすぐ本格的な夏がやってくるなということが視覚的に感じられる、爽やかな短歌でした。,CC BY-NC-ND 4.0,CC BY-NC-ND 4.0
毎月短歌24,村田真央,https://x.com/maomurataxyz,自選,村田より愛を込めて賞,ホームドアを設置した人のやさしさで成仏できない幽霊がいる,,金井水月,https://x.com/kurage_pancake,"人身事故で亡くなった後に、ホームドアが設置される様子をもし幽霊が見ていたら、やりきれない思いになるでしょうね。自分のことは救ってくれなかったくせに、と。
優しさがまるで無い世界よりも、優しさが存在するのに自分に向けられない世界の方が、より絶望が深いような気がします。
心に突き刺さる、とても痛い短歌でした。",CC BY-NC-ND 4.0,CC BY-NC-ND 4.0
毎月短歌24,村田真央,https://x.com/maomurataxyz,自選,村田より愛を込めて賞,ユニコーンの眉毛に惚れて飛び乗ったロイヤルホストまでと叫んで,,まつのせいじ,https://x.com/seiji_skywalker,"ロイホにどうしても行きたい。今すぐ最速で行きたい。そんなときに選ぶのは、一番眉毛のかっこいいユニコーン！
なんと力強い、説得力とスピード感に溢れた短歌でしょうか。惚れるほどの眉毛を持つユニコーンなら、余計なことを言わずダッシュで連れて行ってくれそうです。食べている間もずっと駐車場で待っていてくれそう。いいなあ、うちにも来てくれないかなあ。",CC BY-NC-ND 4.0,CC BY-NC-ND 4.0
毎月短歌24,村田真央,https://x.com/maomurataxyz,自選,村田より愛を込めて賞,気づいてる、あなたを見てるときわたし角度がとても鈍角だから,,白川楼瑠,https://x.com/Loswell612,"「あなた」から見て鈍角の位置、斜め後ろあたりからいつも「あなた」を見つめているのでしょうか。
読み間違いかもしれませんが、初句の「気づいてる、」は「気づいてる？」の意味で読みました。気付かないでままでいてほしいような、気付いてほしいような。もどかしくも切なすぎる短歌で、すごく好きでした。",CC BY-NC-ND 4.0,CC BY-NC-ND 4.0
毎月短歌24,村田真央,https://x.com/maomurataxyz,自選,村田より愛を込めて賞,爽やかな自死として初夏自室にて積読の上に乗せる檸檬,,久方リンネ,https://x.com/hisakatanote,梶井基次郎「檸檬」のように、この檸檬はきっと爆弾なのですね。自室の窓を開け、初夏の風にカーテンが揺れるとても気持ちのいい日に、読みたかった本と一緒に爆発四散して一瞬で死ぬことができたら、それは最上の幸せなのかも。甘美で爽やかな幻想を抱かせてくれる短歌でした。,CC BY-NC-ND 4.0,CC BY-NC-ND 4.0
毎月短歌24,村田真央,https://x.com/maomurataxyz,自選,村田より愛を込めて賞,くちうつしされた氷菓は何色か問われてわたし夏の水彩,,サ行,https://x.com/Ns4HhpKEzA10870,"素敵！と思わず声が出てしまった短歌でした。
氷菓はすぐに液体になるから、思わず飲み込んでしまうでしょう。何色だったか問われて思いを馳せる時、喉をとおっていった氷菓と自分とが一体化して、水彩画になってしまったかのように鮮やかにみずみずしく感じられる。うまく言語化できないけれど、身体的感覚としてもとても納得できる短歌でした。",CC BY-NC-ND 4.0,CC BY-NC-ND 4.0
毎月短歌24,村田真央,https://x.com/maomurataxyz,自選,村田より愛を込めて賞,海鮮丼待ってる君の表情が写ルンですの暗がりにある,,村川愉季,https://x.com/sonatine_yuki,"「写ルンです」を使用していた時代は、今と違って写真の仕上がりをその場で確認することができませんでしたね。現像された写真の色味は現実の世界よりもちょっと濃く見えたような覚えがあります。
「海鮮丼待ってる君」はもしかしたら隅の方に思いがけず写ってしまったのかもしれませんが、きっとわくわくとした表情をしていて、これからもその顔でずっとそこにいてくれるのでしょう。懐かしいような切ないような、素敵な短歌でした。",CC BY-NC-ND 4.0,CC BY-NC-ND 4.0
毎月短歌24,村田真央,https://x.com/maomurataxyz,自選,村田より愛を込めて賞,きみの揺らす現像液は羊水のようだわたしを何度も産んで,,はるかぜ,https://x.com/spring_bird_gr,"こちらはおそらく主体の大切な人である「きみ」が写真の現像をしている場面のようです。写真には「きみ」が撮った「わたし」が写っていて、何枚も何枚も現像されるたびに、「きみ」の手から「わたし」が産み落とされる。まるで「きみ」は「わたし」の創造主のようです。
とても甘美で幻想的で、官能的な光景。ただよう美しい空気に飲まれてしまいそうな短歌でした。",CC BY-NC-ND 4.0,CC BY-NC-ND 4.0
毎月短歌24,村田真央,https://x.com/maomurataxyz,自選,村田より愛を込めて賞,娘らはもう使わないメリットが家族の残量みたいな風呂場,,木ノ宮むじな,https://x.com/rebelxduck,"子どもの頃、実家のシャンプーが確かにメリットだった時期があったのですが、いつのまにか使わなくなってしまいました。成長するにつれてもっと大人っぽいシャンプーにしてみたくなったし、友達に「メリット使ってる」って話すのがなんだか恥ずかしい時期があったから。（花王さんすみません）
娘さんたちの巣立ちの時期はゆっくりと近づいているのでしょうね。家族の成長が嬉しくもどこか淋しい、とても共感できる短歌でした。",CC BY-NC-ND 4.0,CC BY-NC-ND 4.0
